{
  "schemaVersion": "retention-policy-v0",
  "policyId": "retp_v0_1_17_retention_gate",
  "mode": "manual_offline_retention_policy_schema_only",
  "retentionGate": "validate_metadata_retention_ceiling",
  "defaultAction": "reject_unknown_retention_class",
  "artifactClasses": [
    "raw_live_input",
    "redacted_observation_record",
    "redacted_result_record",
    "aggregate_scorecard",
    "public_release_evidence"
  ],
  "rawLiveInputRetentionDays": 0,
  "redactedObservationRetentionDays": 7,
  "redactedResultRetentionDays": 7,
  "aggregateScorecardRetentionDays": 90,
  "publicReleaseEvidenceRetention": "indefinite_if_synthetic_or_non_sensitive",
  "rawContentPersisted": false,
  "retentionSchedulerImplemented": false,
  "deletionImplemented": false,
  "boundary": [
    "manual_offline_only",
    "already_redacted_or_placeholder_fixtures_only",
    "retention_metadata_gate_only",
    "raw_live_inputs_zero_day_do_not_persist",
    "redacted_observations_short_local_window",
    "redacted_results_short_local_window",
    "aggregate_scorecards_metadata_only",
    "public_release_evidence_synthetic_non_sensitive_only",
    "unknown_retention_classes_rejected",
    "no_raw_content_persistence",
    "no_retention_scheduler",
    "no_deletion_implementation",
    "no_live_observation",
    "no_runtime",
    "no_daemon",
    "no_watcher",
    "no_adapter_integration",
    "no_tool_execution",
    "no_memory_write",
    "no_config_write",
    "no_external_publication",
    "no_approval_path",
    "no_blocking",
    "no_allowing",
    "no_authorization",
    "no_enforcement"
  ]
}
